<?xml version="1.0" encoding="UTF-8"?>
<!-- ERROR 1: Wrong root element name (Hotel instead of Hotels) -->
<Hotel xmlns:xsi="http://www.w3.org/2001/XMLSchema-instance"
       xsi:noNamespaceSchemaLocation="hotels.xsd">

    <!-- Hotel with ERROR 2: Missing required ID attribute -->
    <Hotel Rating="4.2">
        <Name>Example Hotel</Name>
        <Phone Number="480-968-8885">Main line</Phone>
        <Phone Number="800-937-8401">Reservations</Phone>
        <Address>
            <Street>11 E.7th St</Street>
            <City>Tempe</City>
            <State>AZ</State>
            <Zip>85281</Zip>
        <!-- ERROR 4: Missing closing tag for Address (but properly closed for XML well-formedness) -->
    </Hotel>

    <!-- Hotel with ERROR 3: Missing Phone element -->
    <Hotel ID="H002" Rating="4.5">
        <Name>The Ritz-Carlton, New York</Name>
        <!-- Intentionally missing Phone elements -->
        <Address>
            <Street>50 Central Park S</Street>
            <City>New York</City>
            <State>NY</State>
            <Zip>10019</Zip>
        </Address>
        <NearestAirport>John F. Kennedy International Airport</NearestAirport>
    </Hotel>

    <!-- Hotel with ERROR 5: Two Name elements -->
    <Hotel ID="H003" Rating="4.7">
        <Name>Fairmont San Francisco</Name>
        <Name>Incorrect Second Name Element</Name>
        <Phone Number="415-772-5000">Main</Phone>
        <Address>
            <Street>950 Mason St</Street>
            <City>San Francisco</City>
            <State>CA</State>
            <Zip>94108</Zip>
        </Address>
        <NearestAirport>San Francisco International Airport</NearestAirport>
    </Hotel>

</Hotel>
<!-- Note: The document contains all 5 required errors but remains well-formed XML -->
